URL,Version,Status,OIDs,Name,Title,Description,Used
https://interoperabilidad.minsal.cl/fhir/ig/urgencia/CodeSystem/indicacion-hospitalizacion,0.1.0,active,,CSIndicacionHospitalizacion,Indicación Hospitalización,"Códigos asociados al destino de hospitalización dados por parte del profesional médico al usuario posterior a su atención de urgencia.","ValueSet/indicacion-hospitalizacion"
https://interoperabilidad.minsal.cl/fhir/ig/urgencia/CodeSystem/indicacion-traslado-otro-centro,0.1.0,active,,CSIndicacionTrasladoOtroCentro,Indicación Traslado Otro Centro,"Códigos correspondientes a la derivación  o traslado del usuario a otro centro asistencial de salud, el cual puede ser o no perteneciente al Servicio Nacional de Salud.","ValueSet/indicacion-traslado-otro-centro"
https://interoperabilidad.minsal.cl/fhir/ig/urgencia/CodeSystem/lesion-autoinflingida,0.1.0,active,,CSLesionAutoinflingida,Lesión Autoinflingida,"Códigos de lesión autoinflingida","ValueSet/lesion-autoinflingida"
https://interoperabilidad.minsal.cl/fhir/ig/urgencia/CodeSystem/tipo-egreso,0.1.0,active,,CSTipoEgreso,Tipo Egreso,"Corresponde a códigos asociados a la decisión del médico u odontólogo del destino que debe seguir el usuario en virtud de su evaluación y situación clínica antes de cerrar el proceso de urgencia. ","ValueSet/tipo-egreso"
https://interoperabilidad.minsal.cl/fhir/ig/urgencia/CodeSystem/unidad-hospitalaria-destino,0.1.0,active,,CSUnidadHospitalariaDestino,Unidad Hospitalaria Destino,"Códigos asociados a Unidad Funcional de destino si es que el paciente requiere hospitalización en el mismo establecimiento.","ValueSet/unidad-hospitalaria-destino"
urn:ietf:bcp:47,2.0.1,active,"2.16.840.1.113883.6.121",Ietf3066,Tags for the Identification of Languages,"Older value from OID registry.  Superceded; see recommendations in BCP-47.","ValueSet/languages"
