URL,Version,Status,OIDs,Name,Title,Description,Used
http://hl7.org/fhir/address-type,4.0.1,active,"2.16.840.1.113883.4.642.4.70",AddressType,AddressType,"The type of an address (physical / postal).","ValueSet/address-type"
http://hl7.org/fhir/address-use,4.0.1,active,"2.16.840.1.113883.4.642.4.68",AddressUse,AddressUse,"The use of an address.","ValueSet/address-use"
http://hl7.org/fhir/administrative-gender,4.0.1,active,"2.16.840.1.113883.4.642.4.2",AdministrativeGender,AdministrativeGender,"The gender of a person used for administrative purposes.","ValueSet/administrative-gender"
http://hl7.org/fhir/allergy-intolerance-category,4.0.1,draft,"2.16.840.1.113883.4.642.4.134",AllergyIntoleranceCategory,AllergyIntoleranceCategory,"Category of an identified substance associated with allergies or intolerances.","ValueSet/allergy-intolerance-category"
http://hl7.org/fhir/allergy-intolerance-criticality,4.0.1,draft,"2.16.840.1.113883.4.642.4.130",AllergyIntoleranceCriticality,AllergyIntoleranceCriticality,"Estimate of the potential clinical harm, or seriousness, of a reaction to an identified substance.","ValueSet/allergy-intolerance-criticality"
http://hl7.org/fhir/allergy-intolerance-type,4.0.1,draft,"2.16.840.1.113883.4.642.4.132",AllergyIntoleranceType,AllergyIntoleranceType,"Identification of the underlying physiological mechanism for a Reaction Risk.","ValueSet/allergy-intolerance-type"
http://hl7.org/fhir/bundle-type,4.0.1,active,"2.16.840.1.113883.4.642.4.621",BundleType,BundleType,"Indicates the purpose of a bundle - how it is intended to be used.","ValueSet/bundle-type"
http://hl7.org/fhir/care-plan-activity-status,4.0.1,draft,"2.16.840.1.113883.4.642.4.147",CarePlanActivityStatus,CarePlanActivityStatus,"Codes that reflect the current state of a care plan activity within its overall life cycle.","ValueSet/care-plan-activity-status"
http://hl7.org/fhir/composition-status,4.0.1,draft,"2.16.840.1.113883.4.642.4.242",CompositionStatus,CompositionStatus,"The workflow/clinical status of the composition.","ValueSet/composition-status"
http://hl7.org/fhir/contact-point-system,4.0.1,active,"2.16.840.1.113883.4.642.4.72",ContactPointSystem,ContactPointSystem,"Telecommunications form for contact point.","ValueSet/contact-point-system"
http://hl7.org/fhir/contact-point-use,4.0.1,active,"2.16.840.1.113883.4.642.4.74",ContactPointUse,ContactPointUse,"Use of contact point.","ValueSet/contact-point-use"
http://hl7.org/fhir/document-reference-status,4.0.1,draft,"2.16.840.1.113883.4.642.4.8",DocumentReferenceStatus,DocumentReferenceStatus,"The status of the document reference.","ValueSet/document-reference-status"
http://hl7.org/fhir/document-relationship-type,4.0.1,draft,"2.16.840.1.113883.4.642.4.245",DocumentRelationshipType,DocumentRelationshipType,"The type of relationship between documents.","ValueSet/document-relationship-type"
http://hl7.org/fhir/encounter-location-status,4.0.1,draft,"2.16.840.1.113883.4.642.4.263",EncounterLocationStatus,EncounterLocationStatus,"The status of the location.","ValueSet/encounter-location-status"
http://hl7.org/fhir/encounter-status,4.0.1,draft,"2.16.840.1.113883.4.642.4.247",EncounterStatus,EncounterStatus,"Current state of the encounter.","ValueSet/encounter-status"
http://hl7.org/fhir/event-status,4.0.1,draft,"2.16.840.1.113883.4.642.4.110",EventStatus,EventStatus,"Codes identifying the lifecycle stage of an event.","ValueSet/event-status"
http://hl7.org/fhir/http-verb,4.0.1,active,"2.16.840.1.113883.4.642.4.625",HTTPVerb,HTTPVerb,"HTTP verbs (in the HTTP command line). See [HTTP rfc](https://tools.ietf.org/html/rfc7231) for details.","ValueSet/http-verb"
http://hl7.org/fhir/identifier-use,4.0.1,active,"2.16.840.1.113883.4.642.4.58",IdentifierUse,IdentifierUse,"Identifies the purpose for this identifier, if known .","ValueSet/identifier-use"
http://hl7.org/fhir/link-type,4.0.1,active,"2.16.840.1.113883.4.642.4.424",LinkType,LinkType,"The type of link between this patient resource and another patient resource.","ValueSet/link-type"
http://hl7.org/fhir/name-use,4.0.1,active,"2.16.840.1.113883.4.642.4.66",NameUse,NameUse,"The use of a human name.","ValueSet/name-use"
http://hl7.org/fhir/observation-status,4.0.1,active,"2.16.840.1.113883.4.642.4.401",ObservationStatus,ObservationStatus,"Codes providing the status of an observation.","ValueSet/observation-status"
http://hl7.org/fhir/reaction-event-severity,4.0.1,draft,"2.16.840.1.113883.4.642.4.136",AllergyIntoleranceSeverity,AllergyIntoleranceSeverity,"Clinical assessment of the severity of a reaction event as a whole, potentially considering multiple different manifestations.","ValueSet/reaction-event-severity"
http://hl7.org/fhir/request-intent,4.0.1,draft,"2.16.840.1.113883.4.642.4.114",RequestIntent,RequestIntent,"Codes indicating the degree of authority/intentionality associated with a request.","ValueSet/request-intent,ValueSet/care-plan-intent"
http://hl7.org/fhir/request-priority,4.0.1,draft,"2.16.840.1.113883.4.642.4.116",RequestPriority,RequestPriority,"Identifies the level of importance to be assigned to actioning the request.","ValueSet/request-priority"
http://hl7.org/fhir/request-status,4.0.1,draft,"2.16.840.1.113883.4.642.4.112",RequestStatus,RequestStatus,"Codes identifying the lifecycle stage of a request.","ValueSet/request-status"
http://hl7.org/fhir/resource-types,4.0.1,active,,ResourceType,ResourceType,"One of the resource types defined as part of this version of FHIR.","ValueSet/resource-types,ValueSet/care-plan-activity-kind"
http://hl7.org/fhir/search-entry-mode,4.0.1,active,"2.16.840.1.113883.4.642.4.623",SearchEntryMode,SearchEntryMode,"Why an entry is in the result set - whether it's included as a match or because of an _include requirement, or to convey information or warning information about the search process.","ValueSet/search-entry-mode"
http://hl7.org/fhir/sid/icd-10,2.1.1,retired,"2.16.840.1.113883.6.3",Icd10,ICD-10,"International Classification of Diseases revision 10 (ICD 10)","ValueSet/VSTerminologiasDiag"
http://loinc.org,3.1.0,active,"2.16.840.1.113883.6.1",LOINC,Logical Observation Identifiers, Names and Codes (LOINC),"LOINC provides a set of universal names and ID codes for identifying laboratory and clinical test results.1,2 LOINC facilitates the exchange and pooling of results, such as blood hemoglobin, serum potassium, or vital signs, for clinical care, outcomes management, and research. LOINC's universal identifiers (names and codes) can be used in the context of order and observation exchanges between information systems that use syntax standards such as HL73, CEN TC251, ISO TC215, ASTM4, and DICOM. Specifically, the identifier can be used as the coded value for an observation in any other standard that uses the observation/observation value paradigm, whether messages, documents, application programming interface (API), etc. For example, LOINC codes are used widely in the OBX segment Observation Identifier field (OBX-3) of an ORU HL7 (HL7 version 2.x or ASTM 1238-9410) message that may be sent between a Clinical Laboratory Information Management Systems (LIMS) and Electronic Health Record Systems (EHR).5, 6 In this way, LOINC codes provide universal identifiers that allow the exchange of clinical data between heterogeneous computing environments.","ValueSet/SignosVitales,ValueSet/c80-doc-typecodes,ValueSet/CodigoExamen,ValueSet/observation-codes,ValueSet/document-classcodes"
http://snomed.info/sct,null,active,"2.16.840.1.113883.6.96",SNOMED_CT,SNOMED CT (all versions),"SNOMED CT is the most comprehensive and precise clinical health terminology product in the world, owned and distributed around the world by The International Health Terminology Standards Development Organisation (IHTSDO).","ValueSet/servicerequest-category,ValueSet/condition-stage,ValueSet/clinical-findings,ValueSet/encounter-reason,ValueSet/participant-role,ValueSet/approach-site-codes,ValueSet/procedure-followup,ValueSet/device-action,ValueSet/medication-codes,ValueSet/body-site,ValueSet/manifestation-or-symptom,ValueSet/procedure-code,ValueSet/reason-medication-not-given-codes,ValueSet/medication-as-needed-reason,ValueSet/device-kind,ValueSet/performer-role,ValueSet/c80-facilitycodes,ValueSet/referencerange-appliesto,ValueSet/c80-practice-codes,ValueSet/route-codes,ValueSet/substance-code,ValueSet/care-plan-activity-outcome,ValueSet/procedure-outcome,ValueSet/procedure-reason,ValueSet/VSTerminologiasDiag,ValueSet/procedure-category,ValueSet/condition-code,ValueSet/allergyintolerance-code,ValueSet/condition-stage-type,ValueSet/procedure-not-performed-reason,ValueSet/care-plan-category,ValueSet/observation-methods,ValueSet/servicerequest-orderdetail,ValueSet/administration-method-codes,ValueSet/condition-severity"
http://terminology.hl7.org/CodeSystem/admit-source,1.0.1,active,"2.16.840.1.113883.4.642.1.1092",AdmitSource,Admit source,"This value set defines a set of codes that can be used to indicate from where the patient came in.","ValueSet/encounter-admit-source"
http://terminology.hl7.org/CodeSystem/allergyintolerance-clinical,1.0.1,active,"2.16.840.1.113883.4.642.1.1373",AllergyIntoleranceClinicalStatusCodes,AllergyIntolerance Clinical Status Codes,"Preferred value set for AllergyIntolerance Clinical Status.","ValueSet/allergyintolerance-clinical"
http://terminology.hl7.org/CodeSystem/allergyintolerance-verification,1.0.1,active,"2.16.840.1.113883.4.642.1.1371",AllergyIntoleranceVerificationStatus,AllergyIntolerance Verification Status,"The verification status to support or decline the clinical status of the allergy or intolerance.","ValueSet/allergyintolerance-verification"
http://terminology.hl7.org/CodeSystem/condition-category,1.0.1,active,"2.16.840.1.113883.4.642.1.1073",ConditionCategoryCodes,Condition Category Codes,"Preferred value set for Condition Categories.","ValueSet/condition-category"
http://terminology.hl7.org/CodeSystem/condition-clinical,3.0.0,active,"2.16.840.1.113883.4.642.1.1074",ConditionClinicalStatusCodes,Condition Clinical Status Codes,"Preferred value set for Condition Clinical Status.","ValueSet/condition-clinical"
http://terminology.hl7.org/CodeSystem/condition-ver-status,2.0.1,active,"2.16.840.1.113883.4.642.1.1075",ConditionVerificationStatus,ConditionVerificationStatus,"The verification status to support or decline the clinical status of the condition or diagnosis.","ValueSet/condition-ver-status"
http://terminology.hl7.org/CodeSystem/contactentity-type,1.0.0,draft,"2.16.840.1.113883.4.642.1.1129",ContactEntityType,Contact entity type,"This example value set defines a set of codes that can be used to indicate the purpose for which you would contact a contact party.","ValueSet/contactentity-type"
http://terminology.hl7.org/CodeSystem/data-absent-reason,1.0.0,active,"2.16.840.1.113883.4.642.4.1048",DataAbsentReason,DataAbsentReason,"Used to specify why the normally expected content of the data element is missing.","ValueSet/data-absent-reason"
http://terminology.hl7.org/CodeSystem/diagnosis-role,1.1.1,active,"2.16.840.1.113883.4.642.1.1054",DiagnosisRole,Diagnosis Role,"This value set defines a set of codes that can be used to express the role of a diagnosis on the Encounter or EpisodeOfCare record.","ValueSet/diagnosis-role"
http://terminology.hl7.org/CodeSystem/diet,1.0.1,active,"2.16.840.1.113883.4.642.1.1091",Diet,Diet,"This value set defines a set of codes that can be used to indicate dietary preferences or restrictions a patient may have.","ValueSet/encounter-diet"
http://terminology.hl7.org/CodeSystem/discharge-disposition,1.0.1,active,"2.16.840.1.113883.4.642.1.1093",DischargeDisposition,Discharge disposition,"This value set defines a set of codes that can be used to where the patient left the hospital.","ValueSet/encounter-discharge-disposition"
http://terminology.hl7.org/CodeSystem/encounter-special-arrangements,1.0.1,active,"2.16.840.1.113883.4.642.1.1090",SpecialArrangements,Special arrangements,"This value set defines a set of codes that can be used to indicate the kinds of special arrangements in place for a patients visit.","ValueSet/encounter-special-arrangements"
http://terminology.hl7.org/CodeSystem/location-physical-type,2.0.1,active,"2.16.840.1.113883.4.642.1.1108",LocationType,Location type,"This example value set defines a set of codes that can be used to indicate the physical form of the Location.  This includes several 'non physical' codes which are still considered a location.","ValueSet/location-physical-type"
http://terminology.hl7.org/CodeSystem/med-admin-perform-function,1.0.1,active,"2.16.840.1.113883.4.642.1.1112",MedicationAdministrationPerformerFunctionCodes,MedicationAdministration Performer Function Codes,"MedicationAdministration Performer Function Codes","ValueSet/med-admin-perform-function"
http://terminology.hl7.org/CodeSystem/medication-admin-category,4.0.1,draft,"2.16.840.1.113883.4.642.4.1111",MedicationAdministration Category Codes,Medication administration  category  codes,"MedicationAdministration Category Codes","ValueSet/medication-admin-category"
http://terminology.hl7.org/CodeSystem/medication-admin-status,4.0.1,draft,"2.16.840.1.113883.4.642.4.1311",MedicationAdministration Status Codes,Medication administration  status  codes,"MedicationAdministration Status Codes","ValueSet/medication-admin-status"
http://terminology.hl7.org/CodeSystem/observation-category,1.0.1,active,"2.16.840.1.113883.4.642.1.1125",ObservationCategoryCodes,Observation Category Codes,"Observation Category codes.","ValueSet/observation-category"
http://terminology.hl7.org/CodeSystem/organization-type,2.0.1,active,"2.16.840.1.113883.4.642.1.1128",OrganizationType,Organization type,"This example value set defines a set of codes that can be used to indicate a type of organization.","ValueSet/organization-type"
http://terminology.hl7.org/CodeSystem/participant-type,4.0.1,draft,"2.16.840.1.113883.4.642.4.1089",ParticipantType,Participant type,"This value set defines a set of codes that can be used to indicate how an individual participates in an encounter.","ValueSet/TipoParticipanteEncuentroUrgencia,ValueSet/encounter-participant-type"
http://terminology.hl7.org/CodeSystem/reason-medication-given,1.0.1,active,"2.16.840.1.113883.4.642.1.1110",ReasonMedicationGivenCodes,Reason Medication Given Codes,"This value set is provided as an example. The value set to instantiate this attribute should be drawn from a robust terminology code system that consists of or contains concepts to support the medication process.","ValueSet/reason-medication-given-codes"
http://terminology.hl7.org/CodeSystem/referencerange-meaning,1.0.1,active,"2.16.840.1.113883.4.642.1.1124",ObservationReferenceRangeMeaningCodes,Observation Reference Range Meaning Codes,"This value set defines a set of codes that can be used to indicate the meaning/use of a reference range for a particular target population.","ValueSet/referencerange-meaning"
http://terminology.hl7.org/CodeSystem/v2-0092,2.0.0,active,"2.16.840.1.113883.18.36",ReAdmissionIndicator,re-admissionIndicator,"Code system of concepts which are used to specify that a patient is being re admitted to a healthcare facilityin from which they were discharged, and indicates the circumstances around such re-admission.  Used in HL7 Version 2.x messagine in the PV1 segment.","ValueSet/v2-0092"
http://terminology.hl7.org/CodeSystem/v2-0131,2.0.0,active,"2.16.840.1.113883.18.58",ContactRole2,contactRole2,"Code system of concepts which specify a relationship role that the next of kin/associated parties plays with regard to the patient. Also used in referrals, for example, it may be necessary to identify the contact representative at the clinic that sent a referral. Used in HL7 Version 2 messaging in the NK1 and CTD segments after 2.5, when it replace 2.16.840.1.113883.18.57.","ValueSet/patient-contactrelationship"
http://terminology.hl7.org/CodeSystem/v2-0203,4.0.0,active,"2.16.840.1.113883.18.108",IdentifierType,identifierType,"HL7-defined code system of concepts specifying type of identifier. Used in HL7 Version 2.x messaging data types CX, PLN, PPN, XCN and XON.","ValueSet/identifier-type"
http://terminology.hl7.org/CodeSystem/v3-ActCode,9.0.0,active,"2.16.840.1.113883.5.4",ActCode,ActCode,"A code specifying the particular kind of Act that the Act-instance represents within its class.    *Constraints:* The kind of Act (e.g. physical examination, serum potassium, inpatient encounter, charge financial transaction, etc.) is specified with a code from one of several, typically external, coding systems. The coding system will depend on the class of Act, such as LOINC for observations, etc.    Conceptually, the Act.code must be a specialization of the Act.classCode. This is why the structure of ActClass domain should be reflected in the superstructure of the ActCode domain and then individual codes or externally referenced vocabularies subordinated under these domains that reflect the ActClass structure.    Act.classCode and Act.code are not modifiers of each other but the Act.code concept should really imply the Act.classCode concept. For a negative example, it is not appropriate to use an Act.code ""potassium"" together with and Act.classCode for ""laboratory observation"" to somehow mean ""potassium laboratory observation"" and then use the same Act.code for ""potassium"" together with Act.classCode for ""medication"" to mean ""substitution of potassium"". This mutually modifying use of Act.code and Act.classCode is not permitted.","ValueSet/v3-ActCode,ValueSet/v3-ActEncounterCode"
http://terminology.hl7.org/CodeSystem/v3-ActPriority,3.0.0,active,"2.16.840.1.113883.5.7",ActPriority,ActPriority,"A set of codes (e.g., for routine, emergency), specifying the urgency under which the Act happened, can happen, is happening, is intended to happen, or is requested/demanded to happen.","ValueSet/v3-ActPriority"
http://terminology.hl7.org/CodeSystem/v3-EncounterSpecialCourtesy,3.0.0,active,"2.16.840.1.113883.5.40",EncounterSpecialCourtesy,EncounterSpecialCourtesy,"**** MISSING DESCRIPTION ****","ValueSet/encounter-special-courtesy"
http://terminology.hl7.org/CodeSystem/v3-NullFlavor,3.0.0,active,"2.16.840.1.113883.5.1008",NullFlavor,NullFlavor,"A collection of codes specifying why a valid value is not present.","ValueSet/encounter-special-courtesy"
http://terminology.hl7.org/CodeSystem/v3-ObservationInterpretation,3.0.0,active,"2.16.840.1.113883.5.83",ObservationInterpretation,ObservationInterpretation,"One or more codes providing a rough qualitative interpretation of the observation, such as ""normal"" / ""abnormal"", ""low"" / ""high"", ""better"" / ""worse"", ""resistant"" / ""susceptible"", ""expected"" / ""not expected"". The value set is intended to be for ANY use where coded representation of an interpretation is needed.","ValueSet/observation-interpretation"
http://terminology.hl7.org/CodeSystem/v3-ParticipationType,5.0.0,active,"2.16.840.1.113883.5.90",ParticipationType,ParticipationType,"A code specifying the meaning and purpose of every Participation instance. Each of its values implies specific constraints on the Roles undertaking the participation.","ValueSet/TipoParticipanteEncuentroUrgencia,ValueSet/encounter-participant-type"
http://terminology.hl7.org/CodeSystem/v3-RoleCode,3.0.0,active,"2.16.840.1.113883.5.111",RoleCode,RoleCode,"A set of codes further specifying the kind of Role; specific classification codes for further qualifying RoleClass codes.","ValueSet/v3-ServiceDeliveryLocationRoleType"
https://hl7chile.cl/fhir/ig/clcore/CodeSystem/CSCodigoServicio,1.9.1,active,,CSCodServicioCL,Tipos de Servicios Remotos,"Códigos para los Servicios realizados en un encuentro remoto según indicaciones del Ministerio de Salud","ValueSet/VSTiposServicio"
https://hl7chile.cl/fhir/ig/clcore/CodeSystem/CSCodigoslenguaje,1.9.1,active,,CSCodigoslenguaje,Codigos Lenguaje,"Codigoslenguaje","ValueSet/VSCodigoslenguaje"
https://hl7chile.cl/fhir/ig/clcore/CodeSystem/CSTipoIdentificador,1.9.1,active,,CSTipoIdentificador,Tipo Identificador,"Tipo Identificador","ValueSet/IdentificadorPrestador,ValueSet/VSTipoIdentificador"
https://hl7chile.cl/fhir/ig/clcore/CodeSystem/CSTiposEncuentroCL,1.9.1,active,,CSTiposEncuentroCL,Tipos de Encuentro,"Códigos de Encuentros según MINSAL","ValueSet/VSTiposEncuentroCL"
https://hl7chile.cl/fhir/ig/clcore/CodeSystem/CodPais,1.9.1,active,,CSCodPaises,Códigos de Países,"Codigos definidos para la identificación de países segun norma ISO3166-N","ValueSet/CodPais"
https://interoperabilidad.minsal.cl/fhir/ig/urgencia/CodeSystem/CSCodigosUrgencia,0.1.0,active,,CSCodigosUrgencia,Códigos de Urgencia,"Códigos creados para registrar información dentro de la atención de urgencia","ValueSet/VSCodigosUrgencia"
https://interoperabilidad.minsal.cl/fhir/ig/urgencia/CodeSystem/CSEstadoCivil,0.1.0,active,,CSEstadoCivil,EstadoCivil,"EstadoCivil","ValueSet/VSEstadoCivil"
https://interoperabilidad.minsal.cl/fhir/ig/urgencia/CodeSystem/CSReligion,0.1.0,active,,CSReligion,Religion,"Religion","ValueSet/VSReligion"
https://interoperabilidad.minsal.cl/fhir/ig/urgencia/CodeSystem/EspecialidadMedica,0.1.0,active,,CSEspecialidadMedica,Especialidad Médica,"Especialidades médicas reconocidas en el sistema de salud de Chile.","ValueSet/EspecialidadMedica"
https://interoperabilidad.minsal.cl/fhir/ig/urgencia/CodeSystem/LeyPrevisional,0.1.0,active,,CSLeyPrevisional,Ley Previsional,"Códigos para la ley previsional","ValueSet/LeyPrevisional"
https://interoperabilidad.minsal.cl/fhir/ig/urgencia/CodeSystem/MedioDeLlegada,0.1.0,active,,CSMedioDeLlegada,Medio de Llegada,"Corresponde a las posibles formas de llegada de un paciente a un servicio de atención de urgencia","ValueSet/MedioDeLlegada"
https://interoperabilidad.minsal.cl/fhir/ig/urgencia/CodeSystem/Procedencia,0.1.0,active,,CSProcedencia,Procedencia,"Corresponde al lugar físico desde donde proviene el paciente cuando consulta en un servicio de atención de urgencia","ValueSet/Procedencia"
https://interoperabilidad.minsal.cl/fhir/ig/urgencia/CodeSystem/PueblosOriginariosCS,0.1.0,active,,PueblosOriginariosCS,Pueblos Originarios de Chile,"Pueblos Originarios de Chile","ValueSet/PueblosOriginariosVS"
https://interoperabilidad.minsal.cl/fhir/ig/urgencia/CodeSystem/RelacionAcompanante,0.1.0,active,,CSRelacionAcompanante,Relación Acompañante,"Códigos asociados a la relación del acompañante con el paciente.","ValueSet/RelacionAcompanante"
https://interoperabilidad.minsal.cl/fhir/ig/urgencia/CodeSystem/TipoParticipanteUrgencia,0.1.0,active,,CSTipoParticipanteUrgencia,Tipo Participante Urgencia,"Tipo de participante en un evento de urgencia.","ValueSet/TipoParticipanteEncuentroUrgencia"
https://interoperabilidad.minsal.cl/fhir/ig/urgencia/CodeSystem/TituloProfesional,0.1.0,active,,CSTituloProfesional,Titulo Profesional,"Códigos asociados a los títulos profesionales de los participantes en un encuentro de urgencia","ValueSet/TituloProfesional"
https://interoperabilidad.minsal.cl/fhir/ig/urgencia/CodeSystem/abandono,0.1.0,active,,CSAbandono,Abandono,"Códigos asociados al tipo de abandono del paciente desde urgencia.","ValueSet/abandono"
https://interoperabilidad.minsal.cl/fhir/ig/urgencia/CodeSystem/categorizacion-discrecional,0.1.0,active,,CSCategorizacionDiscrecional,CSCategorizacionDiscrecional,"Códigos de categorización discrecional de pacientes en el sistema de salud chileno","ValueSet/categorizacion-urgencia"
https://interoperabilidad.minsal.cl/fhir/ig/urgencia/CodeSystem/categorizacion-esi,0.1.0,active,,CSCategorizacionESI,CSCategorizacionESI,"Códigos de categorización ESI de pacientes en el sistema de salud chileno","ValueSet/categorizacion-urgencia"
https://interoperabilidad.minsal.cl/fhir/ig/urgencia/CodeSystem/categorizacion-no-realizada,0.1.0,active,,CSCategorizacionNoRealizada,CSCategorizacionNoRealizada,"Código asociado a la categorización no realizada en el sistema de salud chileno","ValueSet/categorizacion-urgencia"
https://interoperabilidad.minsal.cl/fhir/ig/urgencia/CodeSystem/categorizacion-ugo,0.1.0,active,,CSCategorizacionUGO,CSCategorizacionUGO,"Códigos de categorización Gineco-obstétrica (UGO) de pacientes en el sistema de salud chileno","ValueSet/categorizacion-urgencia"
https://interoperabilidad.minsal.cl/fhir/ig/urgencia/CodeSystem/destino-fallecido,0.1.0,active,,CSDestinoFallecido,Destino Fallecido,"Códigos asociados a la situación final de los usuarios fallecidos durante la atención de urgencia.","ValueSet/destino-fallecido"
https://interoperabilidad.minsal.cl/fhir/ig/urgencia/CodeSystem/destino-traslado,0.1.0,active,,CSDestinoTraslado,Destino Traslado,"Códigos asociados a destino de traslado del paciente desde urgencia.","ValueSet/destino-traslado"
https://interoperabilidad.minsal.cl/fhir/ig/urgencia/CodeSystem/especialidad-odontologica,0.1.0,active,,CSEspecialidadOdontologica,Especialidad Odontológica,"Especialidades odontológicas","ValueSet/especialidad-odontologica"
https://interoperabilidad.minsal.cl/fhir/ig/urgencia/CodeSystem/eventos-urgencia,0.1.0,active,,CSEventosUrgencia,CSEventosUrgencia,"Códigos de eventos de urgencia","ValueSet/eventos-urgencia"
https://interoperabilidad.minsal.cl/fhir/ig/urgencia/CodeSystem/fallecido,0.1.0,active,,CSFallecido,Fallecido,"Códigos asociados al momento en que el paciente fallece en el servicio de urgencia.","ValueSet/fallecido"
https://interoperabilidad.minsal.cl/fhir/ig/urgencia/CodeSystem/indicacion-alta,0.1.0,active,,CSIndicacionAlta,Indicación Alta,"Códigos asociados al destino de alta dados por parte del profesional médico al usuario posterior a su atención de urgencia.","ValueSet/indicacion-alta"
