URL,Version,Status,OIDs,Name,Title,Descriptino,Uses,Used,Sources
https://interoperabilidad.minsal.cl/fhir/ig/hpd/ValueSet/VSEspecialidadBioquim,0.2.2,active,,VSEspecialidadBioquim,Especialidad y Subespecialidad Bioquímica,"Códigos de Especialidad y Subespecialidad Bioquímica.","StructureDefinition/MINSALPrestadorProfesional","Internal"
https://interoperabilidad.minsal.cl/fhir/ig/hpd/ValueSet/VSEspecialidadFarma,0.2.2,active,,VSEspecialidadFarma,Especialidad y Subespecialidad Farmacéuticas o Química Farmacéutica,"Códigos de Especialidad y Subespecialidad Farmacéutica o Química Farmacéutica.","StructureDefinition/MINSALPrestadorProfesional","Internal"
https://interoperabilidad.minsal.cl/fhir/ig/hpd/ValueSet/VSEspecialidadOdonto,0.2.2,active,,VSEspecialidadOdonto,Especialidad y Subespecialidad Odontológica,"Códigos de Especialidad y Subespecialidad Odontológica.","StructureDefinition/MINSALPrestadorProfesional","Internal"
https://interoperabilidad.minsal.cl/fhir/ig/hpd/ValueSet/VSSexoBiologico,0.2.2,active,,VSSexoBiologico,Códigos para sexo biológico en Chile,"Códigos para sexo biológico en Chile según tabla 820.","StructureDefinition/SexoNacimiento820","Internal"
https://interoperabilidad.minsal.cl/fhir/ig/hpd/ValueSet/VSTipoIdentificadorDEIS,0.2.2,active,,VSTipoIdentificadorDEIS,Códigos para tipos de identificadores 820,"Códigos para lo tipos de identificadores según Norma 820, agregando RNPI",,"Internal"
https://interoperabilidad.minsal.cl/fhir/ig/hpd/ValueSet/VSTituloProf,0.2.2,active,,VSTituloProf,Códigos para título profesional,"Códigos para títulos profesionales según Norma Técnica 820","StructureDefinition/MINSALPrestadorProfesional","Internal"
